{
  "$schema": "../schema/area.index.schema.json",
  "brand": "core",
  "area": "global",
  "generatedAt": "2026-10-06T07:56:37.030Z",
  "icons": [
    {
      "name": "fdsi-explore",
      "path": "core/global/fdsi-explore",
      "displayName": "Explorekasjd",
      "description": "Explore/discover icon.",
      "tags": [
        "explore",
        "discover",
        "categories"
      ],
      "status": "active",
      "deprecatedInFavorOf": null,
      "aliases": [],
      "variants": [
        {
          "size": "reg",
          "style": "outline",
          "file": "fdsi-explore-reg-outline.svg"
        },
        {
          "size": "reg",
          "style": "solid",
          "file": "fdsi-explore-reg-solid.svg"
        }
      ]
    },
    {
      "name": "fdsi-home",
      "path": "core/global/fdsi-home",
      "displayName": "Home",
      "description": "Home tab icon.",
      "tags": [
        "home",
        "nav"
      ],
      "status": "active",
      "deprecatedInFavorOf": null,
      "aliases": [],
      "variants": [
        {
          "size": "reg",
          "style": "outline",
          "file": "fdsi-home-reg-outline.svg"
        },
        {
          "size": "reg",
          "style": "solid",
          "file": "fdsi-home-reg-solid.svg"
        }
      ]
    }
  ]
}
