{
  "$schema": "../schema/area.index.schema.json",
  "brand": "core",
  "area": "gx",
  "generatedAt": "2026-09-18T00:00:00Z",
  "icons": [
    {
      "name": "fdsi-my-games",
      "path": "core/gx/fdsi-my-games",
      "status": "active",
      "deprecatedInFavorOf": null,
      "aliases": ["fdsi-my_games"],
      "variants": [
        { "size": "reg", "style": "outline", "file": "fdsi-my-games-reg-outline.svg" },
        { "size": "reg", "style": "solid", "file": "fdsi-my-games-reg-solid.svg" }
      ]
    },
    {
      "name": "fdsi-live-casino",
      "path": "core/gx/fdsi-live-casino",
      "status": "active",
      "deprecatedInFavorOf": null,
      "aliases": ["fdsi-live_casino"],
      "variants": [
        { "size": "reg", "style": "outline", "file": "fdsi-live-casino-reg-outline.svg" },
        { "size": "reg", "style": "solid", "file": "fdsi-live-casino-reg-solid.svg" }
      ]
    }
  ]
}
