{
  "$schema": "../schema/area.index.schema.json",
  "brand": "core",
  "area": "sb",
  "generatedAt": "2026-10-06T11:21:52.287Z",
  "icons": [
    {
      "name": "fdsi-betslip",
      "path": "core/sb/fdsi-betslip",
      "displayName": "Betslipsss",
      "description": "Betting slip icon.sdsds",
      "tags": [
        "betslip",
        "bet",
        "ticket"
      ],
      "status": "active",
      "deprecatedInFavorOf": null,
      "aliases": [],
      "variants": [
        {
          "size": "reg",
          "style": "outline",
          "file": "fdsi-betslip-reg-outline.svg"
        },
        {
          "size": "reg",
          "style": "solid",
          "file": "fdsi-betslip-reg-solid.svg"
        }
      ]
    },
    {
      "name": "fdsi-live",
      "path": "core/sb/fdsi-live",
      "displayName": "Live",
      "description": "Live event/broadcast icon.",
      "tags": [
        "live",
        "streaming",
        "broadcast"
      ],
      "status": "active",
      "deprecatedInFavorOf": null,
      "aliases": [],
      "variants": [
        {
          "size": "reg",
          "style": "outline",
          "file": "fdsi-live-reg-outline.svg"
        },
        {
          "size": "reg",
          "style": "solid",
          "file": "fdsi-live-reg-solid.svg"
        }
      ]
    },
    {
      "name": "fdsi-my-bets",
      "path": "core/sb/fdsi-my-bets",
      "displayName": "My Bets",
      "description": "User's placed/saved bets icon.",
      "tags": [
        "my-bets",
        "bets",
        "account"
      ],
      "status": "active",
      "deprecatedInFavorOf": null,
      "aliases": [
        "fdsi-my_bets"
      ],
      "variants": [
        {
          "size": "reg",
          "style": "outline",
          "file": "fdsi-my-bets-reg-outline.svg"
        },
        {
          "size": "reg",
          "style": "solid",
          "file": "fdsi-my-bets-reg-solid.svg"
        }
      ]
    }
  ]
}
